{
    "report_id": "RPT-SPECS-20260801175216",
    "generated_at": "2026-08-01T17:52:17.0320547Z",
    "subject": "Echoes of You executable specification system",
    "validator_version": "1.0",
    "status": "blocked",
    "summary": {
        "fatal": 8,
        "errors": 8,
        "warnings": 0,
        "passed": 227
    },
    "checks": [
        {
            "rule_id": "DOC-VAL-001",
            "status": "passed",
            "severity": "advisory",
            "message": "required_file",
            "evidence": [
                "Docs/ExecutableSpecs/manifest.yaml"
            ],
            "remediation": ""
        },
        {
            "rule_id": "DOC-VAL-001",
            "status": "passed",
            "severity": "advisory",
            "message": "required_file",
            "evidence": [
                "Docs/ExecutableSpecs/rules/authority.yaml"
            ],
            "remediation": ""
        },
        {
            "rule_id": "DOC-VAL-001",
            "status": "passed",
            "severity": "advisory",
            "message": "required_file",
            "evidence": [
                "Docs/ExecutableSpecs/registry/decisions.yaml"
            ],
            "remediation": ""
        },
        {
            "rule_id": "DOC-VAL-001",
            "status": "passed",
            "severity": "advisory",
            "message": "required_file",
            "evidence": [
                "Docs/ExecutableSpecs/registry/documents.yaml"
            ],
            "remediation": ""
        },
        {
            "rule_id": "DOC-VAL-001",
            "status": "passed",
            "severity": "advisory",
            "message": "required_file",
            "evidence": [
                "Docs/ExecutableSpecs/schemas/rule.schema.yaml"
            ],
            "remediation": ""
        },
        {
            "rule_id": "DOC-VAL-001",
            "status": "passed",
            "severity": "advisory",
            "message": "required_file",
            "evidence": [
                "Docs/ExecutableSpecs/schemas/blueprint.schema.json"
            ],
            "remediation": ""
        },
        {
            "rule_id": "DOC-VAL-001",
            "status": "passed",
            "severity": "advisory",
            "message": "required_file",
            "evidence": [
                "Docs/ExecutableSpecs/schemas/ai-task.schema.json"
            ],
            "remediation": ""
        },
        {
            "rule_id": "DOC-VAL-001",
            "status": "passed",
            "severity": "advisory",
            "message": "required_file",
            "evidence": [
                "Docs/ExecutableSpecs/schemas/validator-report.schema.json"
            ],
            "remediation": ""
        },
        {
            "rule_id": "DOC-VAL-001",
            "status": "passed",
            "severity": "advisory",
            "message": "required_file",
            "evidence": [
                "Docs/ExecutableSpecs/catalogs/scale.yaml"
            ],
            "remediation": ""
        },
        {
            "rule_id": "DOC-VAL-001",
            "status": "passed",
            "severity": "advisory",
            "message": "required_file",
            "evidence": [
                "Docs/ExecutableSpecs/catalogs/props.yaml"
            ],
            "remediation": ""
        },
        {
            "rule_id": "DOC-VAL-001",
            "status": "passed",
            "severity": "advisory",
            "message": "required_file",
            "evidence": [
                "Docs/ExecutableSpecs/catalogs/room_templates.yaml"
            ],
            "remediation": ""
        },
        {
            "rule_id": "DOC-VAL-001",
            "status": "passed",
            "severity": "advisory",
            "message": "required_file",
            "evidence": [
                "Docs/ExecutableSpecs/catalogs/modules.yaml"
            ],
            "remediation": ""
        },
        {
            "rule_id": "DOC-VAL-001",
            "status": "passed",
            "severity": "advisory",
            "message": "required_file",
            "evidence": [
                "Docs/ExecutableSpecs/architecture/school_graph.yaml"
            ],
            "remediation": ""
        },
        {
            "rule_id": "DOC-VAL-001",
            "status": "passed",
            "severity": "advisory",
            "message": "required_file",
            "evidence": [
                "Docs/ExecutableSpecs/gameplay/echo_states.yaml"
            ],
            "remediation": ""
        },
        {
            "rule_id": "DOC-VAL-001",
            "status": "passed",
            "severity": "advisory",
            "message": "required_file",
            "evidence": [
                "Docs/ExecutableSpecs/gameplay/puzzle_archetypes.yaml"
            ],
            "remediation": ""
        },
        {
            "rule_id": "DOC-VAL-001",
            "status": "passed",
            "severity": "advisory",
            "message": "required_file",
            "evidence": [
                "Docs/ExecutableSpecs/gameplay/blueprint_spec.yaml"
            ],
            "remediation": ""
        },
        {
            "rule_id": "DOC-VAL-001",
            "status": "passed",
            "severity": "advisory",
            "message": "required_file",
            "evidence": [
                "Docs/ExecutableSpecs/levels/level_structure.yaml"
            ],
            "remediation": ""
        },
        {
            "rule_id": "DOC-VAL-001",
            "status": "passed",
            "severity": "advisory",
            "message": "required_file",
            "evidence": [
                "Docs/ExecutableSpecs/levels/level_intents.yaml"
            ],
            "remediation": ""
        },
        {
            "rule_id": "DOC-VAL-001",
            "status": "passed",
            "severity": "advisory",
            "message": "required_file",
            "evidence": [
                "Docs/ExecutableSpecs/levels/puzzle_specs.yaml"
            ],
            "remediation": ""
        },
        {
            "rule_id": "DOC-VAL-001",
            "status": "passed",
            "severity": "advisory",
            "message": "required_file",
            "evidence": [
                "Docs/ExecutableSpecs/visual/camera_profiles.yaml"
            ],
            "remediation": ""
        },
        {
            "rule_id": "DOC-VAL-001",
            "status": "passed",
            "severity": "advisory",
            "message": "required_file",
            "evidence": [
                "Docs/ExecutableSpecs/visual/lighting_profiles.yaml"
            ],
            "remediation": ""
        },
        {
            "rule_id": "DOC-VAL-001",
            "status": "passed",
            "severity": "advisory",
            "message": "required_file",
            "evidence": [
                "Docs/ExecutableSpecs/visual/materials.yaml"
            ],
            "remediation": ""
        },
        {
            "rule_id": "DOC-VAL-001",
            "status": "passed",
            "severity": "advisory",
            "message": "required_file",
            "evidence": [
                "Docs/ExecutableSpecs/validators/static_validator.yaml"
            ],
            "remediation": ""
        },
        {
            "rule_id": "DOC-VAL-001",
            "status": "passed",
            "severity": "advisory",
            "message": "required_file",
            "evidence": [
                "Docs/ExecutableSpecs/validators/level_validator.yaml"
            ],
            "remediation": ""
        },
        {
            "rule_id": "DOC-VAL-001",
            "status": "passed",
            "severity": "advisory",
            "message": "required_file",
            "evidence": [
                "Docs/ExecutableSpecs/validators/blueprint_validator.yaml"
            ],
            "remediation": ""
        },
        {
            "rule_id": "DOC-VAL-001",
            "status": "passed",
            "severity": "advisory",
            "message": "required_file",
            "evidence": [
                "Docs/ExecutableSpecs/validators/documentation_validator.yaml"
            ],
            "remediation": ""
        },
        {
            "rule_id": "DOC-VAL-001",
            "status": "passed",
            "severity": "advisory",
            "message": "required_file",
            "evidence": [
                "Docs/ExecutableSpecs/ai/task_schema.yaml"
            ],
            "remediation": ""
        },
        {
            "rule_id": "DOC-VAL-001",
            "status": "passed",
            "severity": "advisory",
            "message": "required_file",
            "evidence": [
                "Docs/ExecutableSpecs/ai/report_schema.yaml"
            ],
            "remediation": ""
        },
        {
            "rule_id": "DOC-VAL-002",
            "status": "passed",
            "severity": "advisory",
            "message": "duplicate_ids",
            "evidence": [
                "Scanned executable YAML files"
            ],
            "remediation": ""
        },
        {
            "rule_id": "DOC-VAL-006",
            "status": "passed",
            "severity": "advisory",
            "message": "asset_reference",
            "evidence": [
                "Assets/Prefabs/Architecture/Arch_Stairs.prefab"
            ],
            "remediation": ""
        },
        {
            "rule_id": "DOC-VAL-006",
            "status": "passed",
            "severity": "advisory",
            "message": "asset_reference",
            "evidence": [
                "Assets/Prefabs/Architecture/Arch_Tree.prefab"
            ],
            "remediation": ""
        },
        {
            "rule_id": "DOC-VAL-006",
            "status": "passed",
            "severity": "advisory",
            "message": "asset_reference",
            "evidence": [